{
  "$schema": "./module-boundaries.schema.json",
  "version": 1,
  "modules": {
    "canon": {
      "roots": [
        "convex/canon"
      ],
      "mayDependOn": [
        "shared"
      ]
    },
    "simulation": {
      "roots": [
        "convex/simulation"
      ],
      "mayDependOn": [
        "canon",
        "knowledge",
        "story",
        "safety",
        "observability",
        "shared"
      ]
    },
    "knowledge": {
      "roots": [
        "convex/knowledge"
      ],
      "mayDependOn": [
        "canon",
        "shared"
      ]
    },
    "story": {
      "roots": [
        "convex/story"
      ],
      "mayDependOn": [
        "canon",
        "knowledge",
        "shared"
      ]
    },
    "editorial": {
      "roots": [
        "convex/editorial",
        "convex/recaps"
      ],
      "mayDependOn": [
        "canon",
        "story",
        "safety",
        "shared",
        "derivedContent"
      ]
    },
    "derivedContent": {
      "roots": [
        "convex/editorial/derived"
      ],
      "mayDependOn": [
        "safety",
        "shared"
      ]
    },
    "publicRead": {
      "roots": [
        "convex/publicRead"
      ],
      "mayDependOn": [
        "canon",
        "knowledge",
        "story",
        "editorial",
        "safety",
        "visualRuntime",
        "shared"
      ]
    },
    "viewer": {
      "roots": [
        "convex/viewer"
      ],
      "mayDependOn": [
        "publicRead",
        "safety",
        "shared"
      ]
    },
    "analytics": {
      "roots": [
        "convex/analytics"
      ],
      "mayDependOn": [
        "publicRead",
        "shared"
      ]
    },
    "quality": {
      "roots": [
        "convex/quality"
      ],
      "mayDependOn": [
        "canon",
        "knowledge",
        "story",
        "editorial",
        "safety",
        "simulation",
        "observability",
        "shared"
      ]
    },
    "visual": {
      "roots": [
        "convex/visual"
      ],
      "mayDependOn": [
        "canon",
        "shared"
      ]
    },
    "visualRuntime": {
      "roots": [
        "convex/visualRuntime"
      ],
      "mayDependOn": [
        "visual",
        "shared"
      ]
    },
    "operations": {
      "roots": [
        "convex/operations"
      ],
      "mayDependOn": [
        "canon",
        "simulation",
        "knowledge",
        "story",
        "editorial",
        "derivedContent",
        "publicRead",
        "safety",
        "observability",
        "shared",
        "analytics",
        "quality"
      ]
    },
    "safety": {
      "roots": [
        "convex/safety"
      ],
      "mayDependOn": [
        "shared"
      ]
    },
    "observability": {
      "roots": [
        "convex/observability"
      ],
      "mayDependOn": [
        "shared"
      ]
    },
    "shared": {
      "roots": [
        "convex/shared"
      ],
      "mayDependOn": []
    },
    "clientPublic": {
      "roots": [
        "src/components/public"
      ],
      "mayDependOn": [
        "publicRead",
        "shared",
        "clientProvider",
        "clientLiveRoute",
        "clientAnalytics",
        "clientViewerWrite",
        "clientViewerProgress",
        "clientAnalyticsTransport"
      ]
    },
    "clientWorldReadOnly": {
      "roots": [
        "src/components/world"
      ],
      "mayDependOn": [
        "publicRead",
        "visualRuntime",
        "shared",
        "clientProvider",
        "clientLiveRoute",
        "clientAnalytics"
      ]
    },
    "clientLive": {
      "roots": [
        "src/components/live"
      ],
      "mayDependOn": [
        "clientPublic",
        "clientWorldReadOnly",
        "clientProvider",
        "clientLiveRoute",
        "publicRead",
        "shared",
        "clientAnalytics"
      ]
    },
    "clientLiveRoute": {
      "roots": [
        "src/components/live/liveMapRoute.ts"
      ],
      "mayDependOn": []
    },
    "clientProvider": {
      "roots": [
        "src/components/ConvexClientProvider.tsx"
      ],
      "mayDependOn": [
        "clientE2EFixture"
      ]
    },
    "clientE2EFixture": {
      "roots": [
        "src/e2e"
      ],
      "mayDependOn": [
        "publicRead",
        "shared"
      ]
    },
    "clientShell": {
      "roots": [
        "src"
      ],
      "mayDependOn": [
        "clientPublic",
        "clientWorldReadOnly",
        "clientLive",
        "clientLiveRoute",
        "clientProvider",
        "publicRead",
        "shared",
        "clientAnalytics",
        "clientAnalyticsTransport"
      ]
    },
    "clientAnalytics": {
      "roots": [
        "src/analytics"
      ],
      "mayDependOn": [
        "shared"
      ]
    },
    "clientViewerWrite": {
      "roots": [
        "src/components/vote"
      ],
      "mayDependOn": [
        "viewer",
        "shared",
        "clientLiveRoute",
        "clientAnalytics"
      ]
    },
    "clientViewerProgress": {
      "roots": [
        "src/components/recap"
      ],
      "mayDependOn": [
        "viewer",
        "shared",
        "clientAnalytics"
      ]
    },
    "clientAnalyticsTransport": {
      "roots": [
        "src/components/analytics"
      ],
      "mayDependOn": [
        "clientAnalytics",
        "analytics",
        "shared"
      ]
    }
  },
  "readOnlyClientBoundary": {
    "roots": [
      "src"
    ],
    "excludeRoots": [
      "src/editor"
    ],
    "exemptFiles": [
      {
        "path": "src/components/ConvexClientProvider.tsx",
        "symbols": [
          "ConvexReactClient"
        ]
      },
      {
        "path": "src/components/vote/useEnvironmentVote.ts",
        "symbols": [
          "useMutation"
        ]
      },
      {
        "path": "src/components/recap/useViewerProgress.ts",
        "symbols": [
          "useMutation"
        ]
      },
      {
        "path": "src/components/analytics/useAnalyticsIngest.ts",
        "symbols": [
          "useMutation"
        ]
      }
    ],
    "forbiddenSymbols": [
      "useMutation",
      "useAction",
      "useConvex",
      "ConvexHttpClient",
      "ConvexReactClient",
      "ConvexClient",
      "BaseConvexClient",
      "useSendInput",
      "useWorldHeartbeat",
      "useServerGame",
      "insertInput",
      "sendWorldInput"
    ]
  },
  "publicFunctionSurface": {
    "scanRoots": [
      "convex"
    ],
    "forbiddenRegistrations": [
      "httpAction"
    ],
    "allowed": [
      {
        "path": "convex/publicRead/readModelFunctions.ts",
        "name": "getPublishedReadModel",
        "kind": "query",
        "gate": "anonymous"
      },
      {
        "path": "convex/publicRead/liveStateFunctions.ts",
        "name": "getPublicDynamicProjection",
        "kind": "query",
        "gate": "anonymous"
      },
      {
        "path": "convex/publicRead/runtimeSnapshotFunctions.ts",
        "name": "getPublicRuntimeSnapshot",
        "kind": "query",
        "gate": "anonymous"
      },
      {
        "path": "convex/publicRead/visualReplayFunctions.ts",
        "name": "getPublicVisualReplay",
        "kind": "query",
        "gate": "anonymous"
      },
      {
        "path": "convex/observability/traces.ts",
        "name": "getTracePublic",
        "kind": "query",
        "gate": "anonymous"
      },
      {
        "path": "convex/viewer/environmentVoteFunctions.ts",
        "name": "getEnvironmentVoteBallot",
        "kind": "query",
        "gate": "anonymous"
      },
      {
        "path": "convex/viewer/environmentVoteFunctions.ts",
        "name": "submitEnvironmentVote",
        "kind": "mutation",
        "gate": "viewer"
      },
      {
        "path": "convex/viewer/viewerProgressFunctions.ts",
        "name": "getViewerProgress",
        "kind": "query",
        "gate": "viewer"
      },
      {
        "path": "convex/viewer/viewerProgressFunctions.ts",
        "name": "recordViewerProgress",
        "kind": "mutation",
        "gate": "viewer"
      },
      {
        "path": "convex/viewer/viewerProgressFunctions.ts",
        "name": "mergeDeviceProgressIntoAccount",
        "kind": "mutation",
        "gate": "viewer"
      },
      {
        "path": "convex/operations/opsConsoleFunctions.ts",
        "name": "inspectWorldState",
        "kind": "query",
        "gate": "operator"
      },
      {
        "path": "convex/operations/opsConsoleFunctions.ts",
        "name": "inspectScheduleAndQueue",
        "kind": "query",
        "gate": "operator"
      },
      {
        "path": "convex/operations/opsConsoleFunctions.ts",
        "name": "listOperatorAudit",
        "kind": "query",
        "gate": "operator"
      },
      {
        "path": "convex/operations/opsConsoleFunctions.ts",
        "name": "describeOperatorSession",
        "kind": "query",
        "gate": "operator"
      },
      {
        "path": "convex/operations/dynamicViewMetricsFunctions.ts",
        "name": "inspectDynamicViewMetrics",
        "kind": "query",
        "gate": "operator"
      },
      {
        "path": "convex/operations/emergencyStopFunctions.ts",
        "name": "inspectEmergencyStop",
        "kind": "query",
        "gate": "operator"
      },
      {
        "path": "convex/operations/proposalReviewFunctions.ts",
        "name": "listProposedEventReviews",
        "kind": "query",
        "gate": "operator"
      },
      {
        "path": "convex/operations/proposalReviewFunctions.ts",
        "name": "reviewProposedEvent",
        "kind": "query",
        "gate": "operator"
      },
      {
        "path": "convex/operations/opsConsoleFunctions.ts",
        "name": "pauseWorld",
        "kind": "mutation",
        "gate": "operator"
      },
      {
        "path": "convex/operations/opsConsoleFunctions.ts",
        "name": "resumeWorld",
        "kind": "mutation",
        "gate": "operator"
      },
      {
        "path": "convex/operations/opsConsoleFunctions.ts",
        "name": "advanceSlot",